phenotypeId,webApiCohortId,cohortName,logicDescription,cohortId
134442000,17681,[PL 134442001] Systemic sclerosis referent concept incident cohort: First occurrence of referent concept + descendants with >=365d prior observation,"Persons with condition occurrence of referent concept (134442) or descendants, for the first time in the person's history. Persons exit cohort at the end of the observation period.",134442001
134442000,17680,[PL 134442002] Systemic sclerosis referent concept prevalent cohort: First occurrence of referent concept + descendants,"Persons with condition occurrence of referent concept (134442) or descendants, for the first time in the person's history, with at least 365 days of prior continuous observation. Persons exit cohort at the end of the observation period.",134442002
134442000,11954,[PL 134442003] Localized Scleroderma or Morphea at first diagnosis,Scleroderma at first diagnosis with 365 days continuous observation. Cohort exit is the end of continuous observable time for the person.,134442003
134442000,17170,[PL 134442004] Systemic sclerosis at first diagnosis,Systemic sclerosis at first diagnosis at first diagnosis with 365 days continuous observation. Cohort exit is the end of continuous observable time for the person.,134442004
134442000,17171,[PL 134442005] Systemic sclerosis or or localized scleroderma at first diagnosis,Systemic sclerosis or Scleroderma at first diagnosis at first diagnosis with 365 days continuous observation. Cohort exit is the end of continuous observable time for the person.,134442005
